{"generatedAt":"2026-10-31T10:29:31.418Z","rulesVersion":10101,"window":{"from":"2026-05-04","to":"2026-10-31"},"counts":{"corpus":33548,"published":7415},"buckets":64,"sources":[{"source":"arxiv","ok":true,"fetched":192,"normalized":192,"notModified":false,"requests":2,"durationMs":3623,"window":{"from":"2026-10-27","to":"2026-10-31"},"finishedAt":"2026-10-31T10:29:35.043Z"},{"source":"biorxiv","ok":true,"fetched":147,"normalized":114,"notModified":false,"requests":7,"durationMs":7135,"window":{"from":"2026-10-27","to":"2026-10-31"},"finishedAt":"2026-10-31T10:29:43.212Z"},{"source":"chemrxiv","ok":true,"fetched":262,"normalized":261,"notModified":false,"requests":1,"durationMs":1034,"window":{"from":"2026-10-27","to":"2026-10-31"},"finishedAt":"2026-10-31T10:29:36.077Z"},{"source":"crossref-journals","ok":true,"fetched":241,"normalized":226,"notModified":false,"requests":12,"durationMs":5867,"window":{"from":"2026-10-27","to":"2026-10-31"},"finishedAt":"2026-10-31T10:29:50.748Z"},{"source":"europepmc","ok":true,"fetched":121,"normalized":121,"notModified":false,"requests":1,"durationMs":1669,"window":{"from":"2026-10-27","to":"2026-10-31"},"finishedAt":"2026-10-31T10:29:44.881Z"},{"source":"rss","ok":true,"fetched":490,"normalized":67,"notModified":false,"requests":7,"durationMs":10765,"window":{"from":"2026-10-27","to":"2026-10-31"},"finishedAt":"2026-10-31T10:30:01.513Z"}],"enrichment":{"openalex":{"lookups":34,"hits":11},"semanticscholar":{"lookups":1167,"hits":818},"pubchem":{"lookups":1,"hits":0},"github":{"lookups":60,"hits":60},"hn":{"lookups":120,"hits":56}},"embeddings":"minilm:Xenova/all-MiniLM-L6-v2","siteUrl":"https://betulcnl.github.io/chembridge-essay-analysis"}
